[I 2026-08-09 15:33:58,717] Trial 14 finished with value: 1.7152105184037911 and parameters: {'blk_0': 'Q5_K', 'blk_1': 'Q8_0', 'blk_2': 'Q4_0', 'blk_3': 'Q4_0', 'blk_4': 'Q8_0', 'blk_5': 'Q5_K', 'blk_6': 'Q5_K', 'blk_7': 'Q4_0', 'blk_8': 'Q5_K', 'blk_9': 'Q8_0', 'blk_10': 'Q6_K', 'blk_11': 'Q5_K', 'blk_12': 'Q5_K', 'blk_13': 'Q6_K', 'blk_14': 'Q4_0', 'blk_15': 'Q5_K', 'blk_16': 'Q6_K', 'blk_17': 'Q5_K', 'blk_18': 'Q4_0', 'blk_19': 'Q8_0', 'blk_20': 'Q5_K', 'blk_21': 'Q4_0', 'blk_22': 'Q4_0', 'blk_23': 'Q5_K', 'blk_24': 'Q8_0', 'blk_25': 'Q5_K'}. Best is trial 0 with value: 2.610975594023467.
2026-08-09 15:34:45,308 candidate evaluation failed (attempt 1/2): 
2026-08-09 15:35:35,444 candidate evaluation failed (attempt 2/2): [
  {
    "build_commit": "fa72aec",
    "build_number": 1,
    "cpu_info": "CPU",
    "gpu_info": "",
    "backends": "CPU",
    "model_filename": "//data/local/tmp/bench/cand_5e95b39d.gguf",
    "mo
[W 2026-08-09 15:35:35,444] Trial 15 failed with parameters: {'blk_0': 'Q5_K', 'blk_1': 'Q4_0', 'blk_2': 'Q5_K', 'blk_3': 'Q4_0', 'blk_4': 'Q8_0', 'blk_5': 'Q8_0', 'blk_6': 'Q8_0', 'blk_7': 'Q6_K', 'blk_8': 'Q8_0', 'blk_9': 'Q8_0', 'blk_10': 'Q6_K', 'blk_11': 'Q8_0', 'blk_12': 'Q5_K', 'blk_13': 'Q6_K', 'blk_14': 'Q4_0', 'blk_15': 'Q5_K', 'blk_16': 'Q4_0', 'blk_17': 'Q5_K', 'blk_18': 'Q8_0', 'blk_19': 'Q8_0', 'blk_20': 'Q6_K', 'blk_21': 'Q4_0', 'blk_22': 'Q4_0', 'blk_23': 'Q6_K', 'blk_24': 'Q8_0', 'blk_25': 'Q8_0'} because of the following error: BenchError('[\n  {\n    "build_commit": "fa72aec",\n    "build_number": 1,\n    "cpu_info": "CPU",\n    "gpu_info": "",\n    "backends": "CPU",\n    "model_filename": "//data/local/tmp/bench/cand_5e95b39d.gguf",\n    "model_type": "gemma3 1B Q8_0",\n    "model_size": 926401792,\n    "model_n_params": 999885952,\n    "n_batch": 2048,\n    "n_ubatch": 512,\n    "n_threads": 8,\n    "cpu_mask": "0x0",\n    "cpu_strict": false,\n    "poll": 50,\n    "type_k": "f16",\n    "type_v": "f16",\n    "n_gpu_layers": -1,\n    "n_cpu_moe": 0,\n    "split_mode": "layer",\n    "main_gpu": 0,\n    "no_kv_offload": false,\n    "flash_attn": -1,\n    "devices": "auto",\n    "tensor_split": "0.00",\n    "tensor_buft_overrides": "none",\n    "load_mode": "mmap",\n    "embeddings": false,\n    "no_op_offload": 0,\n    "no_host": false,\n    "fit_target": 0,\n    "fit_min_ctx": 0,\n    "n_prompt": 128,\n    "n_gen": 0,\n    "n_depth": 0,\n    "test_time": "2026-08-09T10:05:22Z",\n    "avg_ns": 3710932720,\n    "stddev_ns": 986419513,\n    "avg_ts": 35.755883,\n    "stddev_ts": 9.504430,\n    "samples_ns": [ 3013428793, 4408436647 ],\n    "samples_ts": [ 42.4765, 29.0352 ]\n  }').
Traceback (most recent call last):
  File "C:\Users\krish\Documents\VSCode\Arm\optimize\.venv\Lib\site-packages\optuna\study\_optimize.py", line 206, in _run_trial
    value_or_values = func(trial)
  File "C:\Users\krish\Documents\VSCode\Arm\optimize\study_tpe.py", line 39, in objective
    obj = score_candidate(candidate, n_prompt=n_prompt, n_gen=n_gen, reps=reps)
  File "C:\Users\krish\Documents\VSCode\Arm\optimize\fitness.py", line 66, in score_candidate
    raise last_error  # same failure twice -- genuinely broken, not a flake
    ^^^^^^^^^^^^^^^^
  File "C:\Users\krish\Documents\VSCode\Arm\optimize\fitness.py", line 49, in score_candidate
    m: Measurement = evaluate(candidate, n_prompt=n_prompt, n_gen=n_gen, reps=reps, out_name=out_name)
                     ~~~~~~~~^^^^^^^^^^^^^^^^^^^^^^^^^^^^^^^^^^^^^^^^^^^^^^^^^^^^^^^^^^^^^^^^^^^^^^^^^
  File "C:\Users\krish\Documents\VSCode\Arm\optimize\quantize_and_bench.py", line 113, in evaluate
    measurement = _bench(out_name, n_prompt, n_gen, reps)
  File "C:\Users\krish\Documents\VSCode\Arm\optimize\quantize_and_bench.py", line 82, in _bench
    raise BenchError(result.stdout[-2000:] + result.stderr[-2000:])
quantize_and_bench.BenchError: [
  {
    "build_commit": "fa72aec",
    "build_number": 1,
    "cpu_info": "CPU",
    "gpu_info": "",
    "backends": "CPU",
    "model_filename": "//data/local/tmp/bench/cand_5e95b39d.gguf",
    "model_type": "gemma3 1B Q8_0",
    "model_size": 926401792,
    "model_n_params": 999885952,
    "n_batch": 2048,
    "n_ubatch": 512,
    "n_threads": 8,
    "cpu_mask": "0x0",
    "cpu_strict": false,
    "poll": 50,
    "type_k": "f16",
    "type_v": "f16",
    "n_gpu_layers": -1,
    "n_cpu_moe": 0,
    "split_mode": "layer",
    "main_gpu": 0,
    "no_kv_offload": false,
    "flash_attn": -1,
    "devices": "auto",
    "tensor_split": "0.00",
    "tensor_buft_overrides": "none",
    "load_mode": "mmap",
    "embeddings": false,
    "no_op_offload": 0,
    "no_host": false,
    "fit_target": 0,
    "fit_min_ctx": 0,
    "n_prompt": 128,
    "n_gen": 0,
    "n_depth": 0,
    "test_time": "2026-08-09T10:05:22Z",
    "avg_ns": 3710932720,
    "stddev_ns": 986419513,
    "avg_ts": 35.755883,
    "stddev_ts": 9.504430,
    "samples_ns": [ 3013428793, 4408436647 ],
    "samples_ts": [ 42.4765, 29.0352 ]
  }
[W 2026-08-09 15:35:35,445] Trial 15 failed with value None.
2026-08-09 15:36:02,465 candidate evaluation failed (attempt 1/2): 
[W 2026-08-09 15:36:42,679] Trial 16 failed with parameters: {'blk_0': 'Q5_K', 'blk_1': 'Q4_0', 'blk_2': 'Q5_K', 'blk_3': 'Q4_0', 'blk_4': 'Q8_0', 'blk_5': 'Q8_0', 'blk_6': 'Q8_0', 'blk_7': 'Q6_K', 'blk_8': 'Q6_K', 'blk_9': 'Q8_0', 'blk_10': 'Q6_K', 'blk_11': 'Q5_K', 'blk_12': 'Q6_K', 'blk_13': 'Q6_K', 'blk_14': 'Q8_0', 'blk_15': 'Q5_K', 'blk_16': 'Q4_0', 'blk_17': 'Q5_K', 'blk_18': 'Q8_0', 'blk_19': 'Q8_0', 'blk_20': 'Q8_0', 'blk_21': 'Q4_0', 'blk_22': 'Q4_0', 'blk_23': 'Q6_K', 'blk_24': 'Q6_K', 'blk_25': 'Q8_0'} because of the following error: TimeoutExpired(['adb', 'wait-for-device'], 30).
Traceback (most recent call last):
  File "C:\Users\krish\Documents\VSCode\Arm\optimize\.venv\Lib\site-packages\optuna\study\_optimize.py", line 206, in _run_trial
    value_or_values = func(trial)
  File "C:\Users\krish\Documents\VSCode\Arm\optimize\study_tpe.py", line 39, in objective
    obj = score_candidate(candidate, n_prompt=n_prompt, n_gen=n_gen, reps=reps)
  File "C:\Users\krish\Documents\VSCode\Arm\optimize\fitness.py", line 49, in score_candidate
    m: Measurement = evaluate(candidate, n_prompt=n_prompt, n_gen=n_gen, reps=reps, out_name=out_name)
                     ~~~~~~~~^^^^^^^^^^^^^^^^^^^^^^^^^^^^^^^^^^^^^^^^^^^^^^^^^^^^^^^^^^^^^^^^^^^^^^^^^
  File "C:\Users\krish\Documents\VSCode\Arm\optimize\quantize_and_bench.py", line 112, in evaluate
    _quantize(candidate, out_name)
    ~~~~~~~~~^^^^^^^^^^^^^^^^^^^^^
  File "C:\Users\krish\Documents\VSCode\Arm\optimize\quantize_and_bench.py", line 53, in _quantize
    push(str(local_path), type_file_name)
    ~~~~^^^^^^^^^^^^^^^^^^^^^^^^^^^^^^^^^
  File "C:\Users\krish\Documents\VSCode\Arm\optimize\device.py", line 64, in push
    result = _run_with_retry(["adb", "push", local_path, remote(remote_name)], timeout=60)
  File "C:\Users\krish\Documents\VSCode\Arm\optimize\device.py", line 50, in _run_with_retry
    _restart_adb_server()
    ~~~~~~~~~~~~~~~~~~~^^
  File "C:\Users\krish\Documents\VSCode\Arm\optimize\device.py", line 34, in _restart_adb_server
    subprocess.run(["adb", "wait-for-device"], capture_output=True, env=_ENV, timeout=30)
    ~~~~~~~~~~~~~~^^^^^^^^^^^^^^^^^^^^^^^^^^^^^^^^^^^^^^^^^^^^^^^^^^^^^^^^^^^^^^^^^^^^^^^
  File "C:\Users\krish\AppData\Local\Programs\Python\Python313\Lib\subprocess.py", line 556, in run
    stdout, stderr = process.communicate(input, timeout=timeout)
                     ~~~~~~~~~~~~~~~~~~~^^^^^^^^^^^^^^^^^^^^^^^^
  File "C:\Users\krish\AppData\Local\Programs\Python\Python313\Lib\subprocess.py", line 1219, in communicate
    stdout, stderr = self._communicate(input, endtime, timeout)
                     ~~~~~~~~~~~~~~~~~^^^^^^^^^^^^^^^^^^^^^^^^^
  File "C:\Users\krish\AppData\Local\Programs\Python\Python313\Lib\subprocess.py", line 1640, in _communicate
    raise TimeoutExpired(self.args, orig_timeout)
subprocess.TimeoutExpired: Command '['adb', 'wait-for-device']' timed out after 30 seconds
[W 2026-08-09 15:36:42,680] Trial 16 failed with value None.
2026-08-09 15:40:42,245 trial 17: score=1.2105 pp=63.0 tok/s size=886MiB (239.6s)
[I 2026-08-09 15:40:42,245] Trial 17 finished with value: 1.2104766244558283 and parameters: {'blk_0': 'Q5_K', 'blk_1': 'Q4_0', 'blk_2': 'Q5_K', 'blk_3': 'Q4_0', 'blk_4': 'Q8_0', 'blk_5': 'Q8_0', 'blk_6': 'Q8_0', 'blk_7': 'Q6_K', 'blk_8': 'Q8_0', 'blk_9': 'Q8_0', 'blk_10': 'Q6_K', 'blk_11': 'Q8_0', 'blk_12': 'Q5_K', 'blk_13': 'Q6_K', 'blk_14': 'Q4_0', 'blk_15': 'Q5_K', 'blk_16': 'Q4_0', 'blk_17': 'Q5_K', 'blk_18': 'Q8_0', 'blk_19': 'Q8_0', 'blk_20': 'Q8_0', 'blk_21': 'Q4_0', 'blk_22': 'Q4_0', 'blk_23': 'Q6_K', 'blk_24': 'Q8_0', 'blk_25': 'Q8_0'}. Best is trial 0 with value: 2.610975594023467.
2026-08-09 15:41:09,229 candidate evaluation failed (attempt 1/2): 
2026-08-09 15:45:10,566 trial 18: score=0.9181 pp=33.7 tok/s size=871MiB (268.3s)
[I 2026-08-09 15:45:10,566] Trial 18 finished with value: 0.9180503065124687 and parameters: {'blk_0': 'Q8_0', 'blk_1': 'Q8_0', 'blk_2': 'Q4_0', 'blk_3': 'Q5_K', 'blk_4': 'Q4_0', 'blk_5': 'Q4_0', 'blk_6': 'Q4_0', 'blk_7': 'Q8_0', 'blk_8': 'Q6_K', 'blk_9': 'Q6_K', 'blk_10': 'Q5_K', 'blk_11': 'Q5_K', 'blk_12': 'Q6_K', 'blk_13': 'Q4_0', 'blk_14': 'Q8_0', 'blk_15': 'Q6_K', 'blk_16': 'Q4_0', 'blk_17': 'Q5_K', 'blk_18': 'Q8_0', 'blk_19': 'Q8_0', 'blk_20': 'Q6_K', 'blk_21': 'Q6_K', 'blk_22': 'Q5_K', 'blk_23': 'Q5_K', 'blk_24': 'Q6_K', 'blk_25': 'Q8_0'}. Best is trial 0 with value: 2.610975594023467.
2026-08-09 15:48:51,503 trial 19: score=1.9113 pp=103.8 tok/s size=888MiB (220.9s)
[I 2026-08-09 15:48:51,503] Trial 19 finished with value: 1.9112749772056967 and parameters: {'blk_0': 'Q5_K', 'blk_1': 'Q8_0', 'blk_2': 'Q5_K', 'blk_3': 'Q4_0', 'blk_4': 'Q8_0', 'blk_5': 'Q5_K', 'blk_6': 'Q8_0', 'blk_7': 'Q6_K', 'blk_8': 'Q8_0', 'blk_9': 'Q8_0', 'blk_10': 'Q4_0', 'blk_11': 'Q8_0', 'blk_12': 'Q5_K', 'blk_13': 'Q6_K', 'blk_14': 'Q4_0', 'blk_15': 'Q5_K', 'blk_16': 'Q6_K', 'blk_17': 'Q6_K', 'blk_18': 'Q4_0', 'blk_19': 'Q6_K', 'blk_20': 'Q8_0', 'blk_21': 'Q8_0', 'blk_22': 'Q4_0', 'blk_23': 'Q5_K', 'blk_24': 'Q8_0', 'blk_25': 'Q8_0'}. Best is trial 0 with value: 2.610975594023467.
2026-08-09 15:52:42,476 trial 20: score=2.6577 pp=163.4 tok/s size=931MiB (231.0s)
[I 2026-08-09 15:52:42,476] Trial 20 finished with value: 2.6577300801757904 and parameters: {'blk_0': 'Q8_0', 'blk_1': 'Q8_0', 'blk_2': 'Q5_K', 'blk_3': 'Q8_0', 'blk_4': 'Q8_0', 'blk_5': 'Q4_0', 'blk_6': 'Q6_K', 'blk_7': 'Q4_0', 'blk_8': 'Q6_K', 'blk_9': 'Q6_K', 'blk_10': 'Q6_K', 'blk_11': 'Q5_K', 'blk_12': 'Q6_K', 'blk_13': 'Q8_0', 'blk_14': 'Q8_0', 'blk_15': 'Q8_0', 'blk_16': 'Q8_0', 'blk_17': 'Q5_K', 'blk_18': 'Q8_0', 'blk_19': 'Q8_0', 'blk_20': 'Q6_K', 'blk_21': 'Q4_0', 'blk_22': 'Q6_K', 'blk_23': 'Q8_0', 'blk_24': 'Q6_K', 'blk_25': 'Q6_K'}. Best is trial 20 with value: 2.6577300801757904.
2026-08-09 15:55:48,990 trial 21: score=1.9313 pp=102.4 tok/s size=881MiB (186.5s)
[I 2026-08-09 15:55:48,990] Trial 21 finished with value: 1.931274526165933 and parameters: {'blk_0': 'Q4_0', 'blk_1': 'Q6_K', 'blk_2': 'Q4_0', 'blk_3': 'Q8_0', 'blk_4': 'Q8_0', 'blk_5': 'Q4_0', 'blk_6': 'Q6_K', 'blk_7': 'Q4_0', 'blk_8': 'Q5_K', 'blk_9': 'Q6_K', 'blk_10': 'Q6_K', 'blk_11': 'Q5_K', 'blk_12': 'Q6_K', 'blk_13': 'Q8_0', 'blk_14': 'Q6_K', 'blk_15': 'Q8_0', 'blk_16': 'Q8_0', 'blk_17': 'Q6_K', 'blk_18': 'Q4_0', 'blk_19': 'Q5_K', 'blk_20': 'Q5_K', 'blk_21': 'Q4_0', 'blk_22': 'Q6_K', 'blk_23': 'Q8_0', 'blk_24': 'Q6_K', 'blk_25': 'Q6_K'}. Best is trial 20 with value: 2.6577300801757904.
2026-08-09 15:58:54,237 trial 22: score=2.9861 pp=192.3 tok/s size=907MiB (185.2s)
[I 2026-08-09 15:58:54,238] Trial 22 finished with value: 2.986106165926823 and parameters: {'blk_0': 'Q8_0', 'blk_1': 'Q4_0', 'blk_2': 'Q6_K', 'blk_3': 'Q8_0', 'blk_4': 'Q4_0', 'blk_5': 'Q4_0', 'blk_6': 'Q6_K', 'blk_7': 'Q4_0', 'blk_8': 'Q8_0', 'blk_9': 'Q6_K', 'blk_10': 'Q6_K', 'blk_11': 'Q5_K', 'blk_12': 'Q6_K', 'blk_13': 'Q8_0', 'blk_14': 'Q4_0', 'blk_15': 'Q8_0', 'blk_16': 'Q8_0', 'blk_17': 'Q8_0', 'blk_18': 'Q6_K', 'blk_19': 'Q8_0', 'blk_20': 'Q6_K', 'blk_21': 'Q4_0', 'blk_22': 'Q6_K', 'blk_23': 'Q8_0', 'blk_24': 'Q6_K', 'blk_25': 'Q6_K'}. Best is trial 22 with value: 2.986106165926823.
2026-08-09 16:02:04,303 trial 23: score=2.7031 pp=169.9 tok/s size=922MiB (190.1s)
[I 2026-08-09 16:02:04,304] Trial 23 finished with value: 2.7030535672085962 and parameters: {'blk_0': 'Q8_0', 'blk_1': 'Q4_0', 'blk_2': 'Q6_K', 'blk_3': 'Q8_0', 'blk_4': 'Q4_0', 'blk_5': 'Q4_0', 'blk_6': 'Q6_K', 'blk_7': 'Q4_0', 'blk_8': 'Q6_K', 'blk_9': 'Q6_K', 'blk_10': 'Q5_K', 'blk_11': 'Q5_K', 'blk_12': 'Q6_K', 'blk_13': 'Q8_0', 'blk_14': 'Q8_0', 'blk_15': 'Q8_0', 'blk_16': 'Q8_0', 'blk_17': 'Q8_0', 'blk_18': 'Q6_K', 'blk_19': 'Q8_0', 'blk_20': 'Q6_K', 'blk_21': 'Q6_K', 'blk_22': 'Q6_K', 'blk_23': 'Q8_0', 'blk_24': 'Q6_K', 'blk_25': 'Q6_K'}. Best is trial 22 with value: 2.986106165926823.
2026-08-09 16:02:04,304 best score: 2.9861
2026-08-09 16:02:04,304 best config: {'blk_0': 'Q8_0', 'blk_1': 'Q4_0', 'blk_2': 'Q6_K', 'blk_3': 'Q8_0', 'blk_4': 'Q4_0', 'blk_5': 'Q4_0', 'blk_6': 'Q6_K', 'blk_7': 'Q4_0', 'blk_8': 'Q8_0', 'blk_9': 'Q6_K', 'blk_10': 'Q6_K', 'blk_11': 'Q5_K', 'blk_12': 'Q6_K', 'blk_13': 'Q8_0', 'blk_14': 'Q4_0', 'blk_15': 'Q8_0', 'blk_16': 'Q8_0', 'blk_17': 'Q8_0', 'blk_18': 'Q6_K', 'blk_19': 'Q8_0', 'blk_20': 'Q6_K', 'blk_21': 'Q4_0', 'blk_22': 'Q6_K', 'blk_23': 'Q8_0', 'blk_24': 'Q6_K', 'blk_25': 'Q6_K'}
++ date
+ echo 'TPE DONE: Sun Aug  9 16:02:04 IST 2026'
TPE DONE: Sun Aug  9 16:02:04 IST 2026
+ echo ALL_DONE
ALL_DONE
